{
  "$schema": "./workbench-screen-registry.schema.json",
  "schemaVersion": "lotus.workbench.screen-registry.v1",
  "owner": "lotus-workbench",
  "governingIssue": 605,
  "guideStandard": {
    "templatePath": "docs/documentation/workbench-screen-guide-template.md",
    "catalogueSlug": "Screen-Guide-Catalogue",
    "requiredHeadings": [
      "## Current Scope",
      "## Business Purpose",
      "## Who Uses This Screen",
      "## Workflow Position",
      "## Implemented Capabilities",
      "## Decisions And Actions",
      "## Information And Source Authority",
      "## Screen States And Recovery",
      "## Workbench Boundaries",
      "## Adjacent Handoffs",
      "## Evidence And Validation",
      "## First Support Step",
      "## Related Documentation"
    ]
  },
  "routeEntrypoints": [
    {
      "entrypoint": "src/app/page.tsx",
      "routePattern": "/",
      "routeClassification": "alias-redirect",
      "navigationPosture": "active",
      "canonicalSurfaceIds": ["portfolio-review"],
      "implementationEvidence": ["src/apps/home/page.tsx"],
      "note": "Canonical Home currently resolves to Portfolio Review. Authenticated advisor-first Home remains roadmap-owned."
    },
    {
      "entrypoint": "src/app/allocation/page.tsx",
      "routePattern": "/allocation",
      "routeClassification": "active-supported-screen",
      "navigationPosture": "active",
      "canonicalSurfaceIds": ["portfolio-allocation"],
      "implementationEvidence": ["src/app/allocation/page.tsx"]
    },
    {
      "entrypoint": "src/app/book/page.tsx",
      "routePattern": "/book",
      "routeClassification": "active-supported-screen",
      "navigationPosture": "active",
      "canonicalSurfaceIds": ["advisor-book"],
      "implementationEvidence": ["src/app/book/page.tsx"]
    },
    {
      "entrypoint": "src/app/cashflow/page.tsx",
      "routePattern": "/cashflow",
      "routeClassification": "active-supported-screen",
      "navigationPosture": "active",
      "canonicalSurfaceIds": ["projected-cash-movement"],
      "implementationEvidence": ["src/app/cashflow/page.tsx"]
    },
    {
      "entrypoint": "src/app/data-products/page.tsx",
      "routePattern": "/data-products",
      "routeClassification": "active-supported-screen",
      "navigationPosture": "active",
      "canonicalSurfaceIds": ["data-product-discovery"],
      "implementationEvidence": ["src/app/data-products/page.tsx"]
    },
    {
      "entrypoint": "src/app/income/page.tsx",
      "routePattern": "/income",
      "routeClassification": "active-supported-screen",
      "navigationPosture": "active",
      "canonicalSurfaceIds": ["income-and-activity"],
      "implementationEvidence": ["src/app/income/page.tsx"]
    },
    {
      "entrypoint": "src/app/intake/page.tsx",
      "routePattern": "/intake",
      "routeClassification": "active-supported-screen",
      "navigationPosture": "active",
      "canonicalSurfaceIds": ["portfolio-intake"],
      "implementationEvidence": ["src/app/intake/page.tsx"]
    },
    {
      "entrypoint": "src/app/manage/page.tsx",
      "routePattern": "/manage",
      "routeClassification": "alias-redirect",
      "navigationPosture": "active",
      "canonicalSurfaceIds": ["manage-overview"],
      "implementationEvidence": ["src/app/manage/page.tsx"]
    },
    {
      "entrypoint": "src/app/performance/page.tsx",
      "routePattern": "/performance",
      "routeClassification": "active-route-container",
      "navigationPosture": "active",
      "canonicalSurfaceIds": [
        "performance-summary",
        "performance-analysis",
        "performance-advisor-brief",
        "risk-review",
        "performance-evidence"
      ],
      "implementationEvidence": [
        "src/apps/performance/performance-workspace-modes.ts"
      ]
    },
    {
      "entrypoint": "src/app/portfolio/page.tsx",
      "routePattern": "/portfolio",
      "routeClassification": "active-supported-screen",
      "navigationPosture": "active",
      "canonicalSurfaceIds": ["portfolio-review"],
      "implementationEvidence": ["src/app/portfolio/page.tsx"]
    },
    {
      "entrypoint": "src/app/portfolios/page.tsx",
      "routePattern": "/portfolios",
      "routeClassification": "compatibility-route",
      "navigationPosture": "compatibility-only",
      "canonicalSurfaceIds": ["portfolio-review"],
      "implementationEvidence": ["src/app/portfolios/page.tsx"],
      "note": "Compatibility render alias of the canonical Portfolio Review screen."
    },
    {
      "entrypoint": "src/app/positions/page.tsx",
      "routePattern": "/positions",
      "routeClassification": "active-supported-screen",
      "navigationPosture": "active",
      "canonicalSurfaceIds": ["positions"],
      "implementationEvidence": ["src/app/positions/page.tsx"]
    },
    {
      "entrypoint": "src/app/proposals/[proposalId]/page.tsx",
      "routePattern": "/proposals/{proposalId}",
      "routeClassification": "active-supported-screen",
      "navigationPosture": "capability-disabled",
      "canonicalSurfaceIds": ["proposal-detail"],
      "implementationEvidence": ["src/app/proposals/[proposalId]/page.tsx"],
      "note": "Direct supported route; the top-level Proposal shell entry remains capability-disabled."
    },
    {
      "entrypoint": "src/app/proposals/page.tsx",
      "routePattern": "/proposals",
      "routeClassification": "active-route-container",
      "navigationPosture": "capability-disabled",
      "canonicalSurfaceIds": [
        "approval-queue",
        "suitability-review",
        "risk-and-impact",
        "discussion-pack-review",
        "implementation-status"
      ],
      "implementationEvidence": [
        "src/features/proposals/proposal-lifecycle-workspace-view-model.ts"
      ],
      "note": "Direct supported modes; the top-level Proposal shell entry remains capability-disabled."
    },
    {
      "entrypoint": "src/app/proposals/simulate/page.tsx",
      "routePattern": "/proposals/simulate",
      "routeClassification": "active-supported-screen",
      "navigationPosture": "capability-disabled",
      "canonicalSurfaceIds": ["proposal-builder"],
      "implementationEvidence": ["src/app/proposals/simulate/page.tsx"],
      "note": "Direct supported builder; simulation is an in-screen result state, and the top-level Proposal shell entry remains capability-disabled."
    },
    {
      "entrypoint": "src/app/recommendations/page.tsx",
      "routePattern": "/recommendations",
      "routeClassification": "compatibility-route",
      "navigationPosture": "capability-disabled",
      "canonicalSurfaceIds": [
        "advisory-overview",
        "advisor-cockpit",
        "advisory-copilot",
        "opportunities-and-ideas",
        "bank-demo-proof"
      ],
      "implementationEvidence": ["src/apps/recommendations/page.tsx"],
      "note": "Compatibility advisory workspace with implemented modes; the top-level Advisory shell entry remains capability-disabled."
    },
    {
      "entrypoint": "src/app/reports/page.tsx",
      "routePattern": "/reports",
      "routeClassification": "active-supported-screen",
      "navigationPosture": "active",
      "canonicalSurfaceIds": ["report-centre"],
      "implementationEvidence": ["src/app/reports/page.tsx"]
    },
    {
      "entrypoint": "src/app/suite/page.tsx",
      "routePattern": "/suite",
      "routeClassification": "alias-redirect",
      "navigationPosture": "compatibility-only",
      "canonicalSurfaceIds": ["portfolio-review"],
      "implementationEvidence": ["src/app/suite/page.tsx"],
      "note": "Compatibility alias of canonical Home, which currently resolves to Portfolio Review."
    },
    {
      "entrypoint": "src/app/transactions/page.tsx",
      "routePattern": "/transactions",
      "routeClassification": "active-supported-screen",
      "navigationPosture": "active",
      "canonicalSurfaceIds": ["transactions"],
      "implementationEvidence": ["src/app/transactions/page.tsx"]
    },
    {
      "entrypoint": "src/app/workbench/[portfolioId]/page.tsx",
      "routePattern": "/workbench/{portfolioId}",
      "routeClassification": "active-route-container",
      "navigationPosture": "active",
      "canonicalSurfaceIds": [
        "manage-overview",
        "mandate-health",
        "rebalance-waves",
        "construction-alternatives",
        "portfolio-memory",
        "pm-copilot",
        "pm-operating-quality",
        "outcome-reviews",
        "evidence-pack"
      ],
      "implementationEvidence": [
        "src/features/workbench/manage-workspace-navigation.ts"
      ]
    },
    {
      "entrypoint": "src/app/workbench/page.tsx",
      "routePattern": "/workbench",
      "routeClassification": "alias-redirect",
      "navigationPosture": "active",
      "canonicalSurfaceIds": ["manage-overview"],
      "implementationEvidence": ["src/app/workbench/page.tsx"],
      "note": "Routes unscoped entry to the Gateway-backed My Book selection workspace; no portfolio is selected or substituted by the alias."
    }
  ],
  "surfaces": [
    {
      "id": "advisor-book",
      "businessName": "Advisor Book",
      "family": "advisor-book",
      "routePattern": "/book",
      "mode": null,
      "fragment": null,
      "surfaceClassification": "active-screen",
      "navigationPosture": "active",
      "wikiSlug": "Advisor-Book-Workflow",
      "sourceOwners": ["lotus-gateway", "lotus-core"],
      "implementationEvidence": [
        "src/features/advisor-book/components/advisor-book-workspace.tsx",
        "src/features/advisor-book/view-model.ts",
        "tests/unit/advisor-book-view-model.test.ts",
        "tests/integration/advisor-book-workspace.test.tsx"
      ],
      "runtimeEvidence": [
        "tests/e2e/advisor-book-workspace.spec.ts",
        "scripts/live/validation/browser-workflows.mjs"
      ],
      "supportOwner": "lotus-workbench",
      "coverageException": null
    },
    {